{
  "$schema": "../../schemas/vm-manifest.schema.json",
  "apiVersion": "northgate/v1alpha1",
  "kind": "VirtualMachine",
  "metadata": {
    "assetId": "NG-VM-024",
    "name": "NG-RMM-WIN01",
    "ownerRef": "northgate-owner",
    "purpose": "Disposable non-domain-joined Windows RMM monitoring test endpoint",
    "environment": "lab",
    "criticality": "low",
    "dataClassification": "internal",
    "lifecycle": "approved",
    "reviewOrRetirementDate": "2026-10-04",
    "changeRef": "NG-CHG-20260904-001",
    "dependencies": [
      "NG-VM-022"
    ]
  },
  "spec": {
    "intent": "create",
    "generation": 2,
    "imageRef": "windows-11-25h2-english-x64",
    "firmwareProfileRef": "windows-gen2",
    "compute": {
      "processors": 2,
      "memory": {
        "mode": "dynamic",
        "minimumMiB": 4096,
        "startupMiB": 4096,
        "maximumMiB": 8192
      }
    },
    "storage": {
      "profileRef": "lab-ephemeral-f",
      "osDiskGiB": 80
    },
    "network": {
      "profileRef": "business-apps"
    },
    "bootstrapProfileRef": "windows11-disposable-canary",
    "recoveryProfileRef": "none-canary",
    "desiredPowerState": "off",
    "destroyProtection": true
  }
}
