{"$schema":"../../schemas/vm-manifest.schema.json","apiVersion":"northgate/v1alpha1","kind":"VirtualMachine","metadata":{"assetId":"NG-VM-019","changeRef":"NG-CHG-20260803-008","criticality":"moderate","dataClassification":"internal","dependencies":[],"environment":"infrastructure","lifecycle":"approved","name":"NG-MAIL-EXT01","ownerRef":"northgate-owner","purpose":"Simulated external SMTP transfer, authenticated test submission, and isolated mailbox service","reviewOrRetirementDate":"2027-08-02"},"spec":{"bootstrapProfileRef":"debian12-mail-external","compute":{"memory":{"maximumMiB":4096,"minimumMiB":2048,"mode":"dynamic","startupMiB":2048},"processors":2},"desiredPowerState":"running","destroyProtection":true,"firmwareProfileRef":"linux-gen2","generation":2,"imageRef":"debian-12.12-amd64-netinst","intent":"create","network":{"profileRef":"external-mail"},"recoveryProfileRef":"bronze","storage":{"osDiskGiB":40,"profileRef":"persistent-mail-protected"}}}