{
  "$schema": "../../schemas/vm-manifest.schema.json",
  "apiVersion": "northgate/v1alpha1",
  "kind": "VirtualMachine",
  "metadata": {
    "assetId": "NG-VM-023",
    "name": "NG-RMM-CAN01",
    "ownerRef": "northgate-owner",
    "purpose": "Disposable Linux RMM monitoring test endpoint",
    "environment": "lab",
    "criticality": "low",
    "dataClassification": "internal",
    "lifecycle": "approved",
    "reviewOrRetirementDate": "2026-10-04",
    "changeRef": "NG-CHG-20260904-001",
    "dependencies": [
      "NG-VM-022"
    ]
  },
  "spec": {
    "intent": "create",
    "generation": 2,
    "imageRef": "debian-12.12-amd64-netinst",
    "firmwareProfileRef": "linux-gen2",
    "compute": {
      "processors": 2,
      "memory": {
        "mode": "dynamic",
        "minimumMiB": 2048,
        "startupMiB": 2048,
        "maximumMiB": 4096
      }
    },
    "storage": {
      "profileRef": "lab-ephemeral-f",
      "osDiskGiB": 40
    },
    "network": {
      "profileRef": "business-apps"
    },
    "bootstrapProfileRef": "debian12-rmm-canary",
    "recoveryProfileRef": "rmm-canary-disposable",
    "desiredPowerState": "off",
    "destroyProtection": true
  }
}
