{"$schema":"../../schemas/vm-manifest.schema.json","apiVersion":"northgate/v1alpha1","kind":"VirtualMachine","metadata":{"assetId":"NG-VM-020","changeRef":"NG-CHG-20260803-008","criticality":"high","dataClassification":"confidential","dependencies":["NG-VM-019"],"environment":"infrastructure","lifecycle":"approved","name":"NG-MAIL-INT01","ownerRef":"northgate-owner","purpose":"Internal SMTP submission, local delivery, mailbox, antispam, malware scanning, and security telemetry","reviewOrRetirementDate":"2027-08-02"},"spec":{"bootstrapProfileRef":"debian12-mail-internal","compute":{"memory":{"maximumMiB":8192,"minimumMiB":2048,"mode":"dynamic","startupMiB":4096},"processors":2},"desiredPowerState":"running","destroyProtection":true,"firmwareProfileRef":"linux-gen2","generation":2,"imageRef":"debian-12.12-amd64-netinst","intent":"create","network":{"profileRef":"mail-internal"},"recoveryProfileRef":"silver","storage":{"osDiskGiB":80,"profileRef":"persistent-mail-protected"}}}