{
  "$schema": "../../schemas/vm-manifest.schema.json",
  "apiVersion": "northgate/v1alpha1",
  "kind": "VirtualMachine",
  "metadata": {
    "assetId": "NG-VM-018",
    "name": "NG-DEB-CAN01",
    "ownerRef": "northgate-owner",
    "purpose": "Disposable Debian canary for factory, network, bootstrap, monitoring, quarantine, and receipt validation",
    "environment": "lab",
    "criticality": "low",
    "dataClassification": "internal",
    "lifecycle": "approved",
    "reviewOrRetirementDate": "2026-09-30",
    "changeRef": "NG-CHG-20260803-008",
    "dependencies": []
  },
  "spec": {
    "intent": "create",
    "generation": 2,
    "imageRef": "debian-12.12-amd64-netinst",
    "firmwareProfileRef": "linux-gen2",
    "compute": { "processors": 2, "memory": { "mode": "dynamic", "minimumMiB": 2048, "startupMiB": 2048, "maximumMiB": 4096 } },
    "storage": { "profileRef": "lab-ephemeral-d", "osDiskGiB": 40 },
    "network": { "profileRef": "business-apps" },
    "bootstrapProfileRef": "debian12-disposable-canary",
    "recoveryProfileRef": "none-canary",
    "desiredPowerState": "running",
    "destroyProtection": true
  }
}
