{
  "$schema": "../../schemas/vm-manifest.schema.json",
  "apiVersion": "northgate/v1alpha1",
  "kind": "VirtualMachine",
  "metadata": {
    "assetId": "NG-VM-014",
    "name": "NG-MAIL-EXT01",
    "ownerRef": "northgate-owner",
    "purpose": "Simulated external SMTP transfer, authenticated test submission, and isolated mailbox service",
    "environment": "infrastructure",
    "criticality": "moderate",
    "dataClassification": "internal",
    "lifecycle": "approved",
    "reviewOrRetirementDate": "2027-08-02",
    "changeRef": "NG-CHG-20260820-001",
    "dependencies": []
  },
  "spec": {
    "intent": "create",
    "generation": 2,
    "imageRef": "debian-12.12-amd64-netinst",
    "firmwareProfileRef": "linux-gen2",
    "compute": { "processors": 2, "memory": { "mode": "dynamic", "minimumMiB": 2048, "startupMiB": 2048, "maximumMiB": 4096 } },
    "storage": { "profileRef": "persistent-mail-protected", "osDiskGiB": 40 },
    "network": { "profileRef": "external-mail" },
    "bootstrapProfileRef": "debian12-mail-external",
    "recoveryProfileRef": "bronze",
    "desiredPowerState": "running",
    "destroyProtection": true
  }
}
