{"$schema":"../../schemas/vm-manifest.schema.json","apiVersion":"northgate/v1alpha1","kind":"VirtualMachine","metadata":{"assetId":"NG-VM-010","changeRef":"NG-CHG-20260803-008","criticality":"low","dataClassification":"internal","dependencies":[],"environment":"lab","lifecycle":"approved","name":"NG-CANARY-01","ownerRef":"northgate-owner","purpose":"Disposable Windows canary for factory, vTPM, domain, endpoint, monitoring, quarantine, and receipt validation","reviewOrRetirementDate":"2026-09-30"},"spec":{"bootstrapProfileRef":"windows11-disposable-canary","compute":{"memory":{"maximumMiB":8192,"minimumMiB":4096,"mode":"dynamic","startupMiB":4096},"processors":2},"desiredPowerState":"running","destroyProtection":true,"firmwareProfileRef":"windows-gen2","generation":2,"imageRef":"windows-11-25h2-english-x64","intent":"create","network":{"profileRef":"users-workstations"},"recoveryProfileRef":"none-canary","storage":{"osDiskGiB":80,"profileRef":"lab-ephemeral"}}}