{
  "$schema": "../../schemas/vm-manifest.schema.json",
  "apiVersion": "northgate/v1alpha1",
  "kind": "VirtualMachine",
  "metadata": {
    "assetId": "NG-VM-016",
    "name": "NG-HR-APP01",
    "ownerRef": "northgate-owner",
    "purpose": "Internal employee HR application on a dedicated Debian server",
    "environment": "infrastructure",
    "criticality": "high",
    "dataClassification": "restricted",
    "lifecycle": "approved",
    "reviewOrRetirementDate": "2027-08-01",
    "changeRef": "NG-CHG-20260820-001",
    "dependencies": ["NG-VM-013"]
  },
  "spec": {
    "intent": "create",
    "generation": 2,
    "imageRef": "debian-12.12-amd64-netinst",
    "firmwareProfileRef": "linux-gen2",
    "compute": { "processors": 2, "memory": { "mode": "dynamic", "minimumMiB": 2048, "startupMiB": 4096, "maximumMiB": 8192 } },
    "storage": { "profileRef": "persistent-app-protected", "osDiskGiB": 100 },
    "network": { "profileRef": "business-apps" },
    "bootstrapProfileRef": "debian12-employee-hub",
    "recoveryProfileRef": "aegis-app-protected",
    "desiredPowerState": "running",
    "destroyProtection": true
  }
}
