{"$schema":"../../schemas/vm-manifest.schema.json","apiVersion":"northgate/v1alpha1","kind":"VirtualMachine","metadata":{"assetId":"NG-VM-021","changeRef":"NG-CHG-20260803-008","criticality":"low","dataClassification":"internal","dependencies":["NG-VM-019","NG-VM-017"],"environment":"security","lifecycle":"approved","name":"NG-KALI-EXT01","ownerRef":"northgate-owner","purpose":"Simulated external client and adversary-validation workstation isolated from trusted networks","reviewOrRetirementDate":"2027-08-02"},"spec":{"bootstrapProfileRef":"kali-external-lab","compute":{"memory":{"maximumMiB":12288,"minimumMiB":4096,"mode":"dynamic","startupMiB":4096},"processors":4},"desiredPowerState":"running","destroyProtection":true,"firmwareProfileRef":"kali-gen2-unsigned","generation":2,"imageRef":"kali-2026.2-installer-netinst-amd64","intent":"create","network":{"profileRef":"sim-wan"},"recoveryProfileRef":"bronze","storage":{"osDiskGiB":100,"profileRef":"persistent-tooling"}}}